{
  "name": "LUX Default List",
  "timestamp": "2026-03-03T00:00:00.000Z",
  "version": {
    "major": 2,
    "minor": 0,
    "patch": 0
  },
  "tags": {},
  "logoURI": "https://lux.exchange/favicon.png",
  "keywords": ["lux", "default"],
  "tokens": [
    {
      "chainId": 1337,
      "address": "0x0000000000000000000000000000000000000000",
      "name": "LUX",
      "symbol": "LUX",
      "decimals": 18,
      "logoURI": "/tokens/lux.svg"
    },
    {
      "chainId": 1337,
      "address": "0x5FbDB2315678afecb367f032d93F642f64180aa3",
      "name": "Wrapped LUX",
      "symbol": "WLUX",
      "decimals": 18,
      "logoURI": "/tokens/wlux.svg"
    },
    {
      "chainId": 1337,
      "address": "0xe7f1725E7734CE288F8367e1Bb143E90bb3F0512",
      "name": "Bridged ETH",
      "symbol": "ETH",
      "decimals": 18,
      "logoURI": "/tokens/leth.svg"
    },
    {
      "chainId": 1337,
      "address": "0x9fE46736679d2D9a65F0992F2272dE9f3c7fa6e0",
      "name": "Bridged BTC",
      "symbol": "BTC",
      "decimals": 8,
      "logoURI": "/tokens/lbtc.svg"
    },
    {
      "chainId": 1337,
      "address": "0xCf7Ed3AccA5a467e9e704C703E8D87F634fB0Fc9",
      "name": "Bridged USDC",
      "symbol": "USDC",
      "decimals": 6,
      "logoURI": "/tokens/lusd.svg"
    },
    {
      "chainId": 96369,
      "address": "0x0000000000000000000000000000000000000000",
      "name": "LUX",
      "symbol": "LUX",
      "decimals": 18,
      "logoURI": "/tokens/lux.svg"
    },
    {
      "chainId": 96369,
      "address": "0x3C18bB6B17eb3F0879d4653e0120a531aF4d86E3",
      "name": "Wrapped LUX",
      "symbol": "WLUX",
      "decimals": 18,
      "logoURI": "/tokens/wlux.svg"
    },
    {
      "chainId": 96369,
      "address": "0x5a88986958ea76Dd043f834542724F081cA1443B",
      "name": "Bridged ETH",
      "symbol": "ETH",
      "decimals": 18,
      "logoURI": "/tokens/leth.svg"
    },
    {
      "chainId": 96369,
      "address": "0x8a3fad1c7FB94461621351aa6A983B6f814F039c",
      "name": "Bridged BTC",
      "symbol": "BTC",
      "decimals": 8,
      "logoURI": "/tokens/lbtc.svg"
    },
    {
      "chainId": 96369,
      "address": "0x57f9E717dc080a6A76fB6F77BecA8C9C1D266B96",
      "name": "Bridged USDC",
      "symbol": "USDC",
      "decimals": 6,
      "logoURI": "/tokens/lusdc.svg"
    }
  ]
}
