{
    "name": "Lux extended list",
    "timestamp": "2024-10-01T19:32:51.793Z",
    "version": {
        "major": 10,
        "minor": 0,
        "patch": 0
    },
    "tags": {},
    "logoURI": "ipfs://QmNa8mQkrNKp1WEEeGjFezDmDeodkWRevGFN8JCV7b4Xir",
    "keywords": [
        "lux",
        "extended"
    ],
    "tokens": [
        {
            "chainId": 7777,
            "address": "0xd4b2F0435faca8959A7D2e096C2A3Ce9697Ee9fc",
            "name": "Wrapped LUX",
            "symbol": "WLUX",
            "decimals": 18,
            "logoURI": "https://cdn.lux.network/exchange/icon-png/lux.png",
            "extensions": {}
        },
        {
            "chainId": 7777,
            "address": "0x2951A9386df11a4EA8ae5A823B94DC257dEb35Cb",
            "name": "Lux ETH",
            "symbol": "LETH",
            "decimals": 18,
            "logoURI": "https://cdn.lux.network/exchange/icon-png/leth.png",
            "extensions": {}
        },
        {
            "chainId": 7777,
            "address": "0x42b733cA4b3A8FC0237dBE39A47441cfD525f0F1",
            "name": "Lux Dollar",
            "symbol": "LUSD",
            "decimals": 18,
            "logoURI": "https://cdn.lux.network/exchange/icon-png/lusd.png",
            "extensions": {}
        },
        {
            "chainId": 8888,
            "address": "0xA01c406bC54aD9363704E9D26522a4629b5E6263",
            "name": "Wrapped LUX",
            "symbol": "WLUX",
            "decimals": 18,
            "logoURI": "https://cdn.lux.network/exchange/icon-png/lux.png",
            "extensions": {}
        },
        {
            "chainId": 8888,
            "address": "0x5670756808b32c209a25c67481ba9c3c710126bb",
            "name": "Lux ETH",
            "symbol": "LETH",
            "decimals": 18,
            "logoURI": "https://assets.coingecko.com/coins/images/4454/large/0xbtc.png?1561603765",
            "extensions": {}
        },
        {
            "chainId": 8888,
            "address": "0x5fc1f8394a0dfb43d21a03be5656559c45690357",
            "name": "Lux XDAI",
            "symbol": "LXDAI",
            "decimals": 18,
            "logoURI": "https://assets.coingecko.com/coins/images/4454/large/0xbtc.png?1561603765",
            "extensions": {}
        },
        {
            "chainId": 8888,
            "address": "0xa1eeefb7693760e78501b29fcec9fb03ca981d3d",
            "name": "Lux POL",
            "symbol": "LPOL",
            "decimals": 18,
            "logoURI": "https://assets.coingecko.com/coins/images/4454/large/0xbtc.png?1561603765",
            "extensions": {}
        },
        {
            "chainId": 8888,
            "address": "0xcec718c5b0c538cc6c15c151b9dc0f714499eab6",
            "name": "Lux BNB",
            "symbol": "LBNB",
            "decimals": 18,
            "logoURI": "https://assets.coingecko.com/coins/images/4454/large/0xbtc.png?1561603765",
            "extensions": {}
        },
        {
            "chainId": 8888,
            "address": "0xe5c2a45ce63addf0f9581a439c85a214db657813",
            "name": "Lux FTM",
            "symbol": "LFTM",
            "decimals": 18,
            "logoURI": "https://assets.coingecko.com/coins/images/4454/large/0xbtc.png?1561603765",
            "extensions": {}
        },
        {
            "chainId": 8888,
            "address": "0x7e1007b013dcf1d4d49b8ebfdf0c07b7683d4637",
            "name": "Lux CELO",
            "symbol": "LCELO",
            "decimals": 18,
            "logoURI": "https://assets.coingecko.com/coins/images/4454/large/0xbtc.png?1561603765",
            "extensions": {}
        },
        {
            "chainId": 8888,
            "address": "0xb84112ac9318a0b2319aa11d4d10e9762b25f7f4",
            "name": "Lux USD",
            "symbol": "LUSD",
            "decimals": 18,
            "logoURI": "https://assets.coingecko.com/coins/images/4454/large/0xbtc.png?1561603765",
            "extensions": {}
        }
    ]
}